id,title,description,keywords,sector,group,jurisdiction,frequency,granularity_spatial,granularity_temporal,date_earliest,date_latest,access_type,format,provider,reference,url,access_method
147,Intra City Terminal And Depots,This dataset in Figure 2-22: vol1 Map showing various Intra-city (JCTSL) Bus Terminals and Depots,public transport; buses; stations; depots,Public Transportation,L&T Infra Engineering Transport Study,Jaipur City,unknown,city,one-time,,2018,private,printed map,JCTSL,"L&T Infra Engineering (2022) Comprehensive Traffic and Transportation Study for Jaipur Region, vol1, Figure 2-22, pg. 2-38",Document not yet published,Not currently available
163,Jaipur City Bus Fare Matrix,"This dataset provides the fares for the AC & Non A/C Buses, women and students according to the distances.",public transport; buses; fares,Public Transportation,,Jaipur City,unknown,city,one-time,,2024,open,printed table,JCTSL,"Transport Department Of Rajasthan website, NA",https://transport.rajasthan.gov.in/content/transportportal/en/jaipur-bus/fares-tickets/fare-chart.html,Go to source URL
139,Jaipur City Bus Routes Description,"This dataset contains the street no., route description, number of buses and interval(min) of the operating buses in HIndi",public transport; buses,Public Transportation,,Jaipur Region,unknown,region,one-time,,2024,open,printed table,JCTSL,"Jaipur City Transport Services Limited (n.d.), NA",https://transport.rajasthan.gov.in/content/transportportal/en/jaipur-bus/schedules-maps/bus-routes.html,Go to source URL
162,Jaipur Metro Fare Matrix,This dataset provides the Fare structure of metro operations by JMRC dated 11.09.2020,public transport; metro; fares,Public Transportation,,Jaipur North Region,unknown,city,one-time,,2024,open,printed table,JMRCL,"Jaipur Metro Rail Corporation Ltd. (2020), NA",https://transport.rajasthan.gov.in/content/dam/transport/metro/Passenger%20Information/MetroFares/Notification%20Fare%20structure%20of%20metro%20operation%20by%20JMRC%20dtd_11.09.2020.pdf.pdf,Go to source URL
142,Jaipur Metro Stations,contains the finished and proposed map of the number of metro stations and routes in Jaipur City.,public transport; metro,Public Transportation,,Jaipur City,unknown,city,one-time,,,open,printed map,JMRCL,"Jaipur Metro Rail Corporation Ltd. (2024), NA",https://transport.rajasthan.gov.in/content/transportportal/en/metro/PassengerInformation/MetroStations.html,Go to source URL
160,Jaipur Metro Time Table,Contains the Salient feaures of public time table w.e.f. 31.01.2023,public transport; metro,Public Transportation,,Jaipur North Region,unknown,city,one-time,,2023,open,printed table,JMRCL,"Jaipur Metro Rail Corporation Ltd. (2023), NA",https://transport.rajasthan.gov.in/content/dam/transport/metro/Passenger%20Information/Metro%20time%20Table/Salient%20Features%20of%20Time%20Table%20w.e.f.%2030.01.2023.pdf,Go to source URL
137,My Safetipin App Audit Score In Jaipur City,"This catalog contains the reportID, safetiPinScore,mediaURL, comments, observationDateTime, location of various locations in Jaipur city ",safety; women's safety,Public Transportation,MoHUA IUDX data,Jaipur Development Authority (2018),unknown,discrete locations,one-time,,2019,private,json,JDA,"Indian urban data exchange (2023) IUDX, NA",https://catalogue.cos.iudx.org.in/jaipur/dataset/91e116be-03bd-4f3d-a60b-e9db59bf48f0,Go to source URL
153,Operational Brts Corridors,"Map showing Operational BRTS Corridors 
",public transport; buses; BRT,Public Transportation,L&T Infra Engineering Transport Study,Jaipur City,unknown,city,one-time,,2022,open,printed map,JDA,"L&T Infra Engineering (2022) Comprehensive Traffic and Transportation Study for Jaipur Region, vol1, Figure 7-70, Pg. 7-111",Document not yet published,Not currently available
161,Parking Rate At Metro Station,Contains the parking rate at metro station,public transport; metro; parking,Public Transportation,,Jaipur North Region,unknown,city,one-time,,2024,open,printed table,JMRCL,"Jaipur Metro Rail Corporation Ltd. (2024), NA",https://transport.rajasthan.gov.in/content/transportportal/en/metro/PassengerInformation/ParkingatMetroStations.html,Go to source URL
154,Passenger Amenities Near Metro Stations,"This dataset contains the passenger amenities near metro stations like hospitals, cafe & hotels, police stations and others",public transport; metro; amenities,Public Transportation,,Jaipur North Region,unknown,region,one-time,,2024,open,printed table,JMRCL,"Jaipur Metro Rail Corporation Ltd. (2024), NA",https://transport.rajasthan.gov.in/content/transportportal/en/metro/PassengerInformation/PASSENGERAMENITIESNEARMETROSTATIONS.html,Go to source URL
140,Public Transport Access Jaipur,"This dataset contains no. of AC / Non AC buses, No. of bus terminals
,No. of bus stands, No. of bus stops",public transport; accessibility; level of service,Public Transportation,Smartcities.gov.in data,Jaipur Region,unknown,region,one-time,,2019,open,csv,"CDO- Ajay Kumar, Jaipur Nagar Nigam","JSCL (2019) Ministry of housing and urban affairs,smart city data catalogue, NA",https://smartcities.data.gov.in/catalog/publictransportaccessjaipur,Go to source URL
149,Public Transport Road Network,This dataset shows the Coded Public Transport Network for JDA Region,public transport; buses,Public Transportation,L&T Infra Engineering Transport Study,JDA Region,unknown,city,one-time,,2022,private,printed map,JDA,"L&T Infra Engineering (2022) Comprehensive Traffic and Transportation Study for Jaipur Region, vol1, Figure 6-7 pg 6-15",Document not yet published,Not currently available
150,Public Transport Road Network,This dataset shows the Coded Public Transport Network for JMC,public transport; buses,Public Transportation,L&T Infra Engineering Transport Study,JMC Boundary,unknown,city,one-time,,2022,private,printed map,JDA,"L&T Infra Engineering (2022) Comprehensive Traffic and Transportation Study for Jaipur Region, vol1, Figure 6-8 pg 6-15",Document not yet published,Not currently available
138,Recommended Mass Transit Corridor For Jaipur City With Phasing,contains map with population density for the 2nd phase metro of jaipur,public transport; metro,Public Transportation,,Jaipur Municipal Corporation,unknown,region,one-time,,2017,open,printed map,"egis rail,egis india, feedback infra","Comprehensive Mobility Plan, Urban Transport Sector Assessment Report jaipur, fig 0-2",https://transport.rajasthan.gov.in/content/dam/transport/metro/Project/DPR%20Phase%20II/CMP%20Executive%20Summary%20Final.pdf,Go to source URL
143,Route Map Of Jaipur Metro,This dataset shows Route Map of Jaipur Metro,public transport; metro,Public Transportation,,Jaipur City,unknown,city,one-time,,2018,Open,printed map,JMRCL,"Jaipur Metro Rail Corporation Ltd. (2024), NA",https://transport.rajasthan.gov.in/content/transportportal/en/metro/PassengerInformation/MetroStations.html,Go to source URL
157,Type Of Approach To Village And Bus Services In Jaipur Region,This dataset provides information about the approaches to the village and bus services.,public transport; buses,Public Transportation,master plan map,Jaipur Region,unknown,region,one-time,,2001,open,printed map,JDA,"JDA (2011) Master Development Plan 2025, vol1, Map 3-16, pg. 170",https://jda.rajasthan.gov.in/content/dam/raj/udh/development-authority/jda-jaipur/pdf/MDP/Vol1.pdf,Go to source URL
167,Electricity Consumption Jaipur,"This catalog contains data about consumption of electricity for domestic, industrial,commerial, public waterworks and street lights, and other consumptions",energy; electricity; utilities,Resource Use,Smartcities.gov.in data,Jaipur Municipal Corporation Greater (2019),unknown,region,one-time,,2018,open,csv,"CDO- Ajay Kumar, Jaipur Nagar Nigam","JSCL (2019) Ministry of housing and urban affairs,smart city data catalogue, NA",https://smartcities.data.gov.in/catalog/electricity-consumption-jaipur,Go to source URL
168,Water Consumption Jaipur,"This catalogue contains data for ward wise water supply capacity,domestic water consumption and percentage area of water supply network",water; utilities,Resource Use,Smartcities.gov.in data,Jaipur Municipal Corporation,unknown,region,one-time,,2018,open,csv,"CDO- Ajay Kumar, Jaipur Nagar Nigam","JSCL (2019) Ministry of housing and urban affairs,smart city data catalogue, NA",https://smartcities.data.gov.in/catalog/water-consumption-jaipur,Go to source URL
170,"Satellite Image Cartosat 1 ,Cartodem (2.5m,10m Spatial Resolution)",contains satellite imagery of DSM of 10m Posting and 2.5m Posting with swath width 14km x14km  is available,satellite images; Cartosat,Satellite Images,Cartosat,India,4-5 days,spatial grid,one-time,2005,2019,paid,geotiff image,ISRO,"ISRO (2024) Bhoonidhi, NA",https://bhoonidhi.nrsc.gov.in/bhoonidhi/index.html,Go to source URL
169,"Satellite Image Cartosat 1 Pan, Stereo (2.5m Spatial Resolution)","contains satellite imagery of 2.5m spatial resolution PAN-Ortho Rectified (without GCP), Stereo- RAD Ortho kit with 27.5kmx27.5km swath width",satellite images; Cartosat,Satellite Images,Cartosat,India,4-5 days,spatial grid,one-time,2005,2019,paid,geotiff image,ISRO,"ISRO (2024) Bhoonidhi, NA",https://bhoonidhi.nrsc.gov.in/bhoonidhi/index.html,Go to source URL
171,"Satellite Image Cartosat 2 Pan, (1m Spatial Resolution)",contains satellite imagery of GEO Orthokit and Ortho Rectified (without GCP) with swath width of 9.8km x 9.8km is available,satellite images; Cartosat,Satellite Images,Cartosat,India,4-5 days,spatial grid,one-time,2007,2019,paid,geotiff image,ISRO,"ISRO (2024) Bhoonidhi, NA",https://bhoonidhi.nrsc.gov.in/bhoonidhi/index.html,Go to source URL
173,"Satellite Image Cartosat 2s, Mx, (1.60m Spatial Resolution)","contains satellite imagery of GEO Orthokit, Ortho Rectified (without GCP),Ortho Mosaic (Min:2, Max : 4 ), and NCC & FCC (Ortho Rectified-without GCP) with swath width of 9.8km x 9.8km is available",satellite images; Cartosat,Satellite Images,Cartosat,India,4-5 days,spatial grid,one-time,2016,2024,paid,geotiff image,ISRO,"ISRO (2024) Bhoonidhi, NA",https://bhoonidhi.nrsc.gov.in/bhoonidhi/index.html,Go to source URL
174,"Satellite Image Cartosat 2s, Pan+Mx, (0.60m Spatial Resolution)","contains satellite imagery of Pan-sharpened, Pan-sharpened Mosaic (Min:2, Max:4), and NCC & FCC (Pan-sharpened) with swath width of 9.8km x 9.8km is available",satellite images; Cartosat,Satellite Images,Cartosat,India,4-5 days,spatial grid,one-time,2016,2024,paid,geotiff image,ISRO,"ISRO (2024) Bhoonidhi, NA",https://bhoonidhi.nrsc.gov.in/bhoonidhi/index.html,Go to source URL
172,"Satellite Image Cartosat 2s, Pan, (0.60m Spatial Resolution)",contains satellite imagery of GEO Orthokit and Ortho Rectified (without GCP) with swath width of 9.8km x 9.8km is available,satellite images; Cartosat,Satellite Images,Cartosat,India,4-5 days,spatial grid,one-time,2016,2024,paid,geotiff image,ISRO,"ISRO (2024) Bhoonidhi, NA",https://bhoonidhi.nrsc.gov.in/bhoonidhi/index.html,Go to source URL
177,"Satellite Image Cartosat 3, Pan+Mx, (0.45m Spatial Resolution)",contains satellite imagery of Pan-sharpened and NCC & FCC (Pan-sharpened) with swath width of 10km x 10km is available,satellite images; Cartosat,Satellite Images,Cartosat,India,4-5 days,spatial grid,one-time,2019,2024,paid,geotiff image,ISRO,"ISRO (2024) Bhoonidhi, NA",https://bhoonidhi.nrsc.gov.in/bhoonidhi/index.html,Go to source URL
175,"Satellite Image Cartosat 3, Pan, (0.28m,0.45m Spatial Resolution)","contains satellite imagery of 0.28m- GEO Orthokit, and 0.25m and 0.45m - Ortho Rectified (without GCP) with swath width of 17km x 17 km is available",satellite images; Cartosat,Satellite Images,Cartosat,India,4-5 days,spatial grid,one-time,2019,2024,paid,geotiff image,ISRO,"ISRO (2024) Bhoonidhi, NA",https://bhoonidhi.nrsc.gov.in/bhoonidhi/index.html,Go to source URL
176,"Satellite Image Cartosat 3,Mx (1.10m Spatial Resolution)","contains satellite imagery of GEO Orthokit, Ortho Rectified (without GCP) with a swath width of 17km x 17 km and Ortho Rectified (without GCP), NCC & FCC (Ortho Rectified-without GCP) of  swath width of 10km x 10km is available",satellite images; Cartosat,Satellite Images,Cartosat,India,4-5 days,spatial grid,one-time,2019,2024,paid,geotiff image,ISRO,"ISRO (2024) Bhoonidhi, NA",https://bhoonidhi.nrsc.gov.in/bhoonidhi/index.html,Go to source URL
179,"Satellite Image Eos-04(Or Risat-1a), [Sar ,Frs1 ,Frs2] (3m-50m Spatial Resolution)","contains satellite imagery of Geometrically Terrain Corrected, Single Look Complex,Multi Look Ground Range,Covariance, and Polarimetric Decomposed  with swath width of 20km x 25km is available",satellite images; EOS,Satellite Images,,India,25 days,spatial grid,one-time,2022,2024,paid,geotiff image,ISRO,"ISRO (2024) Bhoonidhi, NA",https://bhoonidhi.nrsc.gov.in/bhoonidhi/index.html,Go to source URL
181,"Satellite Image Kompsat-3/3a ,Pan & Mx(0.5, 2.2m Spatial Resolution)","contains satellite imagery of Geo Orthokit,and Bundled with swath width of 15km x 15km is available",satellite images; Kompsat,Satellite Images,,India,3-4 days,spatial grid,one-time,2012,2024,paid,geotiff image,ISRO,"ISRO (2024) Bhoonidhi, NA",https://bhoonidhi.nrsc.gov.in/bhoonidhi/index.html,Go to source URL
186,"Satellite Image Landsat-1 Or Erts-1 ,Mss- (79m Spatial Resolution)",contains satellite imagery of (MSS at 79m spatial resolution(RBV)-40m),satellite images; Landsat,Satellite Images,Landsat,India,18 days,spatial grid,one-time,1972,1978,open,geotiff image,NASA,"US Geological Survey (2024) USGS Earth Explorer, NA",https://earthexplorer.usgs.gov/,Go to source URL
187,"Satellite Image Landsat-2 ,Mss- (79m Spatial Resolution)","contains satellite imagery of (MSS at 79m spatial resolution, (RBV)-40m)",satellite images; Landsat,Satellite Images,Landsat,India,18 days,spatial grid,one-time,1975,1982,open,geotiff image,NASA,"US Geological Survey (2024) USGS Earth Explorer, NA",https://earthexplorer.usgs.gov/,Go to source URL
188,"Satellite Image Landsat-3 ,Mss- (79m Spatial Resolution)",contains satellite imagery of (MSS at 79m spatial resolution(RBV)-40m),satellite images; Landsat,Satellite Images,Landsat,India,18 days,spatial grid,one-time,1978,1983,open,geotiff image,NASA,"US Geological Survey (2024) USGS Earth Explorer, NA",https://earthexplorer.usgs.gov/,Go to source URL
189,"Satellite Image Landsat-4 ,Mss-(79m) & Tm(30m,120m)","contains satellite imagery of spatial resolution 30 meters (TM, VIS/NIR/SWIR), 120 meters (thermal); 79 meters (MSS)",satellite images; Landsat,Satellite Images,Landsat,India,16 days,spatial grid,one-time,1982,1993,open,geotiff image,NASA,"US Geological Survey (2024) USGS Earth Explorer, NA",https://earthexplorer.usgs.gov/,Go to source URL
190,"Satellite Image Landsat-5 ,Mss-(79m) & Tm(30m,120m)","contains satellite imagery of spatial resolution 30 meters (TM, VIS/NIR/SWIR), 120 meters (thermal); 79 meters (MSS)",satellite images; Landsat,Satellite Images,Landsat,India,16 days,spatial grid,one-time,1984,2013,open,geotiff image,NASA,"US Geological Survey (2024) USGS Earth Explorer, NA",https://earthexplorer.usgs.gov/,Go to source URL
191,"Satellite Image Landsat-7 ,Etm+(15m,30m,120m)","contains satellite imagery of spatial resolution 30 meters (VIS/NIR/SWIR), 60 meters (thermal), 15 meters (panchromatic)",satellite images; Landsat,Satellite Images,Landsat,India,16 days,spatial grid,one-time,1999,2017,open,geotiff image,NASA,"US Geological Survey (2024) USGS Earth Explorer, NA",https://earthexplorer.usgs.gov/,Go to source URL
192,"Satellite Image Landsat-8 ,Pan(15m),Oli (30m) & Tirs(100m)","contains satellite imagery of spatial resolution 30 meters (OLI), 100 meters (TIRS), 15 meters (panchromatic)",satellite images; Landsat,Satellite Images,Landsat,India,16 days,spatial grid,one-time,2013,2024,open,geotiff image,NASA,"US Geological Survey (2024) USGS Earth Explorer, NA",https://earthexplorer.usgs.gov/,Go to source URL
193,"Satellite Image Landsat-9 ,Pan(15m),Oli-2 (30m) & Tirs-2 (100m)","contains satellite imagery of spatial resolution 30 meters (OLI-2), 100 meters (TIRS-2), 15 meters (panchromatic)",satellite images; Landsat,Satellite Images,Landsat,India,16 days,spatial grid,one-time,2021,2024,open,geotiff image,NASA,"US Geological Survey (2024) USGS Earth Explorer, NA",https://earthexplorer.usgs.gov/,Go to source URL
180,"Satellite Image Novasar-1,All Modes (6-33 M Spatial Resolution)","contains satellite imagery of Geometrically Terrain Corrected, Single Look Complex Slant range, and Multi Look Ground Range with swath width of 13-400km x 13-400km is available",satellite images; Novasar,Satellite Images,,India,16 days,spatial grid,one-time,2018,2024,paid,geotiff image,ISRO,"ISRO (2024) Bhoonidhi, NA",https://bhoonidhi.nrsc.gov.in/bhoonidhi/index.html,Go to source URL
182,"Satellite Image Resourcesat-1, Liss-3(23.5m),Liss-4(5.8m),Awifs(56m Spatial Resolution)","contains satellite imagery of  LISS-3(23.5m spatial resolution, swath width-141 km),LISS-4{5.8m spatial resolution, swath width -[23.9 km (Mx) 70 kms (Mono)]},AWiFS {56m spatial resolution, swath width-[740 km (Combined) 370 km (Each head)]} is available",satellite images; Resourcesat,Satellite Images,Resourcesat,India,24 days,spatial grid,one-time,2003,2024,open,geotiff image,ISRO,"ISRO (2024) Bhoonidhi, NA",https://bhoonidhi.nrsc.gov.in/bhoonidhi/index.html,Go to source URL
183,"Satellite Image Resourcesat-2, Liss-3(23.5m),Liss-4(5.8m),Awifs(56m Spatial Resolution)","contains satellite imagery of  LISS-3(23.5m spatial resolution, swath width-141 km),LISS-4{5.8m spatial resolution, swath width -[23.9 km (Mx) 70 kms (Mono)]},AWiFS {56m spatial resolution, swath width-[740 km (Combined) 370 km (Each head)]} is available",satellite images; Resourcesat,Satellite Images,Resourcesat,India,24 days,spatial grid,one-time,2011,2024,open,geotiff image,ISRO,"ISRO (2024) Bhoonidhi, NA",https://bhoonidhi.nrsc.gov.in/bhoonidhi/index.html,Go to source URL
184,"Satellite Image Resourcesat-2a, Liss-3(23.5m),Liss-4(5.8m),Awifs(56m Spatial Resolution)","contains satellite imagery of  LISS-3(23.5m spatial resolution, swath width-141 km),LISS-4{5.8m spatial resolution, swath width -[23.9 km (Mx) 70 kms (Mono)]},AWiFS {56m spatial resolution, swath width-[740 km (Combined) 370 km (Each head)]} is available",satellite images; Resourcesat,Satellite Images,Resourcesat,India,24 days,spatial grid,one-time,2016,2024,open,geotiff image,ISRO,"ISRO (2024) Bhoonidhi, NA",https://bhoonidhi.nrsc.gov.in/bhoonidhi/index.html,Go to source URL
178,"Satellite Image Risat-1 , [Sar ,Frs1 ,Frs2] (3m-50m Spatial Resolution)","contains satellite imagery of Geometrically Terrain Corrected, Single Look Complex, and Multi Look Ground Range  with swath width of 25km x 25km is available",satellite images; Risat,Satellite Images,,India,25 days,spatial grid,one-time,2012,2016,paid,geotiff image,ISRO,"ISRO (2024) Bhoonidhi, NA",https://bhoonidhi.nrsc.gov.in/bhoonidhi/index.html,Go to source URL
185,Satellite Image Sentinel-2 (10m Spatial Resolution),"contains satellite imagery of MSI(visible,NIR-10m,6 bands at 20 m resolution,3 bands at 60 m resolution)",satellite images; Sentinel,Satellite Images,,India,5 days,spatial grid,one-time,2015,2024,open,geotiff image,ESA,"Copernicus Browser (2024) Copernicus Browser, NA",browser.dataspace.copernicus.eu/?zoom=12&lat=26.8887&lng=75.83126,Go to source URL
209,Accessibility To Hospitals In Jaipur Region,Map highlighting the accessibility to hospitals in Jaipur Region.,hospitals; health care,Services,master plan map,Jaipur Region,unknown,region,one-time,,2001,open,printed map,JDA,"JDA (2011) Master Development Plan 2025, vol1, Map 3-11, pg.165",https://jda.rajasthan.gov.in/content/dam/raj/udh/development-authority/jda-jaipur/pdf/MDP/Vol1.pdf,Go to source URL
207,Assessment Of College Availability In Jaipur Region,Map evaluating the accessibility of colleges in Jaipur Region.,colleges; schools,Services,master plan map,Jaipur Region,unknown,region,one-time,,2001,open,printed map,JDA,"JDA (2011) Master Development Plan 2025, vol1, Map 3-8, pg. 162",https://jda.rajasthan.gov.in/content/dam/raj/udh/development-authority/jda-jaipur/pdf/MDP/Vol1.pdf,Go to source URL
208,Assessment Of Health Centre Availability In Jaipur Region,Map assessing the distribution of health centers in Jaipur Region.,health care,Services,master plan map,Jaipur Region,unknown,region,one-time,,2001,open,printed map,JDA,"JDA (2011) Master Development Plan 2025, vol1, Map 3-10, pg.164",https://jda.rajasthan.gov.in/content/dam/raj/udh/development-authority/jda-jaipur/pdf/MDP/Vol1.pdf,Go to source URL
206,Assessment Of Senior Secondary School Availability In Jaipur Region,Map assessing the availability of senior secondary schools in Jaipur Region.,schools,Services,master plan map,Jaipur Region,unknown,region,one-time,,2001,open,printed map,JDA,"JDA (2011) Master Development Plan 2025, vol1, Map 3-7, pg. 161",https://jda.rajasthan.gov.in/content/dam/raj/udh/development-authority/jda-jaipur/pdf/MDP/Vol1.pdf,Go to source URL
211,Availability Of Credit Banking Facility In Agriculture Productive Areas -Jaipur Region,Map indicating credit banking facilities in agricultural areas of Jaipur Region.,financial services,Services,master plan map,Jaipur Region,unknown,region,one-time,,2001,open,printed map,JDA,"JDA (2011) Master Development Plan 2025, vol1, Map 3-13, pg. 167",https://jda.rajasthan.gov.in/content/dam/raj/udh/development-authority/jda-jaipur/pdf/MDP/Vol1.pdf,Go to source URL
212,Availability Of Postal Services In Jaipur Region,Map detailing the availability of postal services in Jaipur Region.,postal services,Services,master plan map,Jaipur Region,unknown,region,one-time,,2001,open,printed map,JDA,"JDA (2011) Master Development Plan 2025, vol1, Map 3-14, pg. 168",https://jda.rajasthan.gov.in/content/dam/raj/udh/development-authority/jda-jaipur/pdf/MDP/Vol1.pdf,Go to source URL
205,Availability Of Primary Schools Within Jaipur Region,Map showing the distribution of primary schools across Jaipur Region.,schools,Services,master plan map,Jaipur Region,unknown,region,one-time,,2001,open,printed map,JDA,"JDA (2011) Master Development Plan 2025, vol1, Map 3-6, pg.160",https://jda.rajasthan.gov.in/content/dam/raj/udh/development-authority/jda-jaipur/pdf/MDP/Vol1.pdf,Go to source URL
210,Bank Facility In Jaipur Region,Map showing the locations of banks within Jaipur Region.,financial services,Services,master plan map,Jaipur Region,unknown,region,one-time,,2001,open,printed map,JDA,"JDA (2011) Master Development Plan 2025, vol1, Map 3-12, pg.166",https://jda.rajasthan.gov.in/content/dam/raj/udh/development-authority/jda-jaipur/pdf/MDP/Vol1.pdf,Go to source URL
204,Citizen Facilities Jaipur,This catalog provides the citizen facilitation centers with average monthly footfalls,citizen facilities,Services,Smartcities.gov.in data,Jaipur Municipal Corporation,unknown,region,one-time,,2018,open,csv,"CDO- Ajay Kumar, Jaipur Nagar Nigam","JSCL (2019) Ministry of housing and urban affairs,smart city data catalogue, NA",https://smartcities.data.gov.in/catalog/citizen-facilities-jaipur,Go to source URL
198,"Civic And Other Amenities In Slums, 2009","contains the Class and name of town, Name of the slum, No. of households (approximate), Population of the Slum (approximate), Paved roads (in kms.), System of drainage( Open, Closed, Both, Nil), Number of latrines, Community, No. of tap points/ public hydrants installed for supply of protected water, Electricity (Number of connections) in Domestic, Road lighting (points) and Others",slums; amenities,Services,Census handbook,Jaipur District,unknown,district,one-time,,2009,open,xls/xlsx,"Directorate of Census Operations, Rajasthan","Directorate of Census Operations, Rajasthan (2014) Census of India 2011 - Rajasthan - Series 09 - Part XII B - District Census Handbook, Jaipur, Town Statement-VII_0812",https://censusindia.gov.in/nada/index.php/catalog/1069/download/3291/DH_2011_0812-Jaipur.zip,Go to source URL
194,"Civic And Other Amenities, 2009","contains the Name of Town, Road length (in kms.), System of drainage( Open, Closed, Both -Open & Closed), Number of latrines(Pit System,Flush/Pour Flush (Water borne),Service,Others), Protected water supply(Source of supply, System of storage with capacity in kilo litres), Fire fighting service, Electrification (Number of connections of Domestic, Industrial, Commercial, Road lighting points, others)",amenities,Services,Census handbook,Jaipur District,unknown,district,one-time,,2009,open,xls/xlsx,"Directorate of Census Operations, Rajasthan","Directorate of Census Operations, Rajasthan (2014) Census of India 2011 - Rajasthan - Series 09 - Part XII B - District Census Handbook, Jaipur, Town Statement-III_0812",https://censusindia.gov.in/nada/index.php/catalog/1069/download/3291/DH_2011_0812-Jaipur.zip,Go to source URL
203,Community Facilities Jaipur,"This catalog contains the number of ward wise Community Hall / Auditorium / Convention Center / Swimming Pools / Sports Ground / Theatre, Facility Name and capacity",community facilities,Services,Smartcities.gov.in data,Jaipur Municipal Corporation,unknown,region,one-time,,2018,open,csv,"CDO- Ajay Kumar, Jaipur Nagar Nigam","JSCL (2019) Ministry of housing and urban affairs,smart city data catalogue, NA",https://smartcities.data.gov.in/catalog/community-facilities-jaipur,Go to source URL
201,Cultural Heritage Jaipur,"This catalog provides the Name of heritage,Nature of heritage (open space, monuments, street etc.),Heritage use, Age of heritage ( In Years) ",heritage,Services,Smartcities.gov.in data,Jaipur Municipal Corporation,unknown,region,one-time,,2019,open,csv,"CDO- Ajay Kumar, Jaipur Nagar Nigam","JSCL (2019) Ministry of housing and urban affairs,smart city data catalogue, NA",https://smartcities.data.gov.in/catalog/culturalheritagejaipur,Go to source URL
