id,title,description,keywords,sector,group,jurisdiction,frequency,granularity_spatial,granularity_temporal,date_earliest,date_latest,access_type,format,provider,reference,url,access_method
96,Socio-Economic Potential,"A socio economic potential map has been arrived at based upon the economic and facility & service potential in the villages. 
",economy; industries,Economy,master plan map,Jaipur District,unknown,district,one-time,,2001,open,printed map,JDA,"JDA (2011) Master Development Plan 2025, vol1, Map 2-17 (pg. 69)",https://jda.rajasthan.gov.in/content/dam/raj/udh/development-authority/jda-jaipur/pdf/MDP/Vol1.pdf,Go to source URL
99,Tourist Arrivals,Location-wise Tourist Arrival Statistics (in million),tourism,Economy,L&T Infra Engineering Transport Study,Jaipur Region,unknown,region,one-time,,2016,private,printed table,"Office of statistics, Department of Tourism, Rajasthan","L&T Infra Engineering (2022) Comprehensive Traffic and Transportation Study for Jaipur Region, vol1, Table 2-11, p.g 2-25",Document not yet published,Not currently available
94,Workers Profile,"contains Work Force Participation Rate, Jaipur District, 2001",workers,Economy,,Jaipur District,unknown,district,one-time,,2001,open,printed table,"Directorate of Census Operations, Rajasthan","JDA (2011) Master Development Plan 2025, vol1, Table 2-13, Table 2-14, Table 2-15, pg.60-61",https://jda.rajasthan.gov.in/content/dam/raj/udh/development-authority/jda-jaipur/pdf/MDP/Vol1.pdf,Go to source URL
103,Air Quality (Cpcb),"This dataset provides PM2.5,PM10,NO,NO2,NOx, NH3,SO2, CO, Ozone,Benzene, Toluene, Xylene, O Xylene, Eth-Benzene, MP-Xylene, AT, RH,WS,WD,RF,TOT-RF, SR,BP, VWS for 1day,8hours, 1 hour and 15min time stamps",air quality; CPCB; PM2.5; PM10; NO2; CO; O3,Environment,,Jaipur Region,Every 15 min,discrete locations,one-time,2017,2023,open,csv,CPCB,"Cental Pollution Control Board (2024) Central Control Room for Air Quality Management, NA",https://airquality.cpcb.gov.in/ccr/#/caaqm-dashboard-all/caaqm-landing/caaqm-data-repository,Go to source URL
101,Air Quality Index (Caaqms),"This dataset provides the Levels of PM2.5, PM10, NO2, CO, O3",air quality; CAAQMS; PM2.5; PM10; NO2; CO; O3,Environment,,Jaipur Region,Every Year,discrete locations,one-time,2017,2020,open,xls/xlsx,RSPCB,"Rajasthan State Pollution Control Board (2024), NA",https://environment.rajasthan.gov.in/content/environment/en/rajasthan-state-pollution-control-board/EnvironmentalReport/DownloadableAirQualityIndexCAAQMS.html,Go to source URL
105,Climate Outlook Of Jaipur City,This dataset provides the Climatic details like Temperature and Rainfall statistics of Jaipur City.,climate; temperature; rainfall,Environment,master plan data,Jaipur Development Authority (2018),unknown,region,one-time,,2011,open,printed table,JDA,"JDA (2011) Master Development Plan 2025, vol1, Table 3-25, pg.191",https://jda.rajasthan.gov.in/content/dam/raj/udh/development-authority/jda-jaipur/pdf/MDP/Vol1.pdf,Go to source URL
104,Natural Landscape Jaipur,"This catalog contains area of natural features like lake,forest,ecologically sensitve area of JDA region",topography,Environment,Smartcities.gov.in data,Jaipur Development Authority (2018),unknown,region,one-time,,2019,open,csv,"CDO- Ajay Kumar, Jaipur Nagar Nigam","JSCL (2019) Ministry of housing and urban affairs,smart city data catalogue, NA",https://smartcities.data.gov.in/catalog/natural-landscape-jaipur,Go to source URL
102,Noise Quality Bulletin Of Rajasthan State,This dataset provides the Decibel levels in different zones,noise; decibel elvels,Environment,,Jaipur Region,Every Month,discrete locations,one-time,2024,2024,open,printed table,RSPCB,"Rajasthan State Pollution Control Board (2024), NA",https://environment.rajasthan.gov.in/content/environment/en/rajasthan-state-pollution-control-board/EnvironmentalReport/noise-monitoring-report.html,Go to source URL
106,Open Series Map (Scale: 1:50000),contains open series map image in Scale: 1:50000 based on sheet no. (not georeferenced),map; land cover,Environment,,India,unknown,spatial grid,one-time,,2011,open,printed map,Survey of india,"Survey of India (2024) Online Maps Portal, NA",https://onlinemaps.surveyofindia.gov.in/FreeMapSpecification.aspx,Go to source URL
100,"Physical Aspects And Location Of Towns, 2009","contains the Name of town, Physical aspects(Rainfall & Temperature), Name of and road distance (in kms.) from (State HQ, District HQ, Sub-Division/ Taluk/ Tahsil / Police station/ Development  Block/ Island HQ, Nearest city with population of one lakh and more, Nearest city with population of five lakh and more) Railway station and Bus route",topography; settlements,Environment,Census handbook,Jaipur District,unknown,district,one-time,,2009,open,xls/xlsx,"Directorate of Census Operations, Rajasthan","Directorate of Census Operations, Rajasthan (2014) Census of India 2011 - Rajasthan - Series 09 - Part XII B - District Census Handbook, Jaipur, Town Statement-II_0812",https://censusindia.gov.in/nada/index.php/catalog/1069/download/3291/DH_2011_0812-Jaipur.zip,Go to source URL
107,Intermediate Public Transport Facilities,This dataset shows the Issues with IPT Facilities,intermediate public transport; three wheelers,Intermediate Public Transport,L&T Infra Engineering Transport Study,Jaipur Development Authority (2018),unknown,region,one-time,,2018,private,chart,JDA,"L&T Infra Engineering (2022) Comprehensive Traffic and Transportation Study for Jaipur Region, vol1, Figure 3-14 pg 3-52",Document not yet published,Not currently available
109,Base Map,"This dataset provides information about Region Boundary, Contour, Railways, National Highway, State Highway, City Road-Major, City Road-Minor, Unmetalled roads, River Course/Nallah/Waterbody, Walled City",base map; land use,Land Use,master plan map,Jaipur Development Authority (2018),unknown,region,one-time,,2009,open,vector map,JDA,"JDA (2011) Master Development Plan 2025, website, Mapbook 1",https://jda.rajasthan.gov.in/content/dam/raj/udh/development-authority/jda-jaipur/pdf/MDP/Mapbook1.pdf,Go to source URL
110,Generalised Existing Land Use Map,This dataset provides the generalised existing land use for Jaipur U1 Area.,land use,Land Use,master plan map,Jaipur Development Authority (2018),unknown,region,one-time,,2009,open,vector map,JDA,"JDA (2011) Master Development Plan 2025, website, Mapbook 2",https://jda.rajasthan.gov.in/content/dam/raj/udh/development-authority/jda-jaipur/pdf/MDP/Mapbook2.pdf,Go to source URL
112,Land Use Plan,This dataset provides the proposed land use plan 2025 for Jaipur U1 Area.,land use,Land Use,master plan map,Jaipur Development Authority (2018),unknown,region,one-time,,2025,open,vector map,JDA,"JDA (2011) Master Development Plan 2025, website, Mapbook 4",https://jda.rajasthan.gov.in/content/dam/raj/udh/development-authority/jda-jaipur/pdf/MDP/Mapbook4.pdf,Go to source URL
111,Land Utilization Map,This dataset provides the Land Utilization of Jaipur Region,land utilization; land use,Land Use,master plan map,Jaipur Development Authority (2018),unknown,region,one-time,,2009,open,vector map,JDA,"JDA (2011) Master Development Plan 2025, website, Mapbook 3",https://jda.rajasthan.gov.in/content/dam/raj/udh/development-authority/jda-jaipur/pdf/MDP/Mapbook3.pdf,Go to source URL
108,Land Utilization Of Jaipur District,This dataset provides the land utilization of different landuse for Jaipur District,land utilization; land use,Land Use,,Jaipur District,unknown,district,one-time,,2001,open,printed table,JDA,"JDA (2011) Master Development Plan 2025, vol1, Table 2-5, Chart 2-1, pg.48",https://jda.rajasthan.gov.in/content/dam/raj/udh/development-authority/jda-jaipur/pdf/MDP/Vol1.pdf,Go to source URL
113,No. Of Households Having Bicycle,This data contains no. and % of households having bicycle.,bicycles,Private Vehicles,Census handbook,Jaipur District,unknown,district,one-time,,2011,open,printed table,"Directorate of Census Operations, Rajasthan","Directorate of Census Operations, Rajasthan (2014) Census of India 2011 - Rajasthan - Series 09 - Part XII B - District Census Handbook, Jaipur, Table -9, pg-569",https://censusindia.gov.in/nada/index.php/catalog/1069,Go to source URL
115,No. Of Households Having Car/Jeep/Van,This data contains no. and % of households having Car/Jeep/Van.,cars; jeeps; vans; four wheelers,Private Vehicles,Census handbook,Jaipur District,unknown,district,one-time,,2011,open,printed table,"Directorate of Census Operations, Rajasthan","Directorate of Census Operations, Rajasthan (2014) Census of India 2011 - Rajasthan - Series 09 - Part XII B - District Census Handbook, Jaipur, Table -9, pg-569",https://censusindia.gov.in/nada/index.php/catalog/1069,Go to source URL
114,No. Of Households Having Scooter/Motorcycle/Moped,This data contains no. and % of households havingScooter/Motorcycle/Moped.,scooter; motorbikes; two wheelers,Private Vehicles,Census handbook,Jaipur District,unknown,district,one-time,,2011,open,printed table,"Directorate of Census Operations, Rajasthan","Directorate of Census Operations, Rajasthan (2014) Census of India 2011 - Rajasthan - Series 09 - Part XII B - District Census Handbook, Jaipur, Table -9, pg-569",https://censusindia.gov.in/nada/index.php/catalog/1069,Go to source URL
118,Registration Of Vehicles In Jaipur District,contains dataset of Registration of Vehicles in Jaipur District in yearly basis from 1990-2007,vehicle regisrations,Private Vehicles,,Jaipur District,unknown,district,one-time,1990,2007,open,printed table,"Transport Department, Govt. of Rajasthan","Master Development Plan 2025 (2011), vol1, Table 2-30, pg. 94",https://jda.rajasthan.gov.in/content/dam/raj/udh/development-authority/jda-jaipur/pdf/MDP/Vol1.pdf,Go to source URL
119,Total Number Of Vehicles Registered,"This dataset provides a comprehensive overview of the number of registered vehicles in Jaipur from 2010-11 to 2020-21, categorized by different types of vehicles.",vehicle regisrations,Private Vehicles,,Jaipur District,Every Year,district,one-time,2010,2021,open,printed table,"RTO, Jaipur","Transport Department, Government of Rajasthan (2020-21) STATISTICAL YEAR BOOK, Table 5.5, Table 5.6",https://transport.rajasthan.gov.in/content/dam/transport/transport-dept/pdf/Statistical%20abstract%202020-21/Transport_Dept_Year_Book.pdf,Go to source URL
117,Vehicle Ownership Information,This dataset shows Details of Vehicle Ownership in JMC and JDA,vehicle ownership,Private Vehicles,L&T Infra Engineering Transport Study,Jaipur City,unknown,city,one-time,,2018,private,chart,JDA,"L&T Infra Engineering (2022) Comprehensive Traffic and Transportation Study for Jaipur Region, vol1, Figure 3-8 pg 3-34",Document not yet published,Not currently available
116,Vehicle Registrations Data Jaipur,"This catalog contains the city name, the no. of registrations of buses, four-wheelers, two-wheelers, Goods Carrier Vehicles, Light Motor Vehicles, and miscellaneous others",vehicle regisrations,Private Vehicles,Smartcities.gov.in data,Jaipur City,unknown,city,one-time,2015,2018,open,csv,"CDO- Ajay Kumar, Jaipur Nagar Nigam","JSCL (2019) Ministry of housing and urban affairs,smart city data catalogue, NA",https://smartcities.data.gov.in/catalog/vehicle-registrations-data-jaipur,Go to source URL
122,Budget For Open Spaces Development For Jaipur,This catalog contains Total Municipal Budget (in lakhs) and Municipal budget allocation for open spaces and / or parks (including development & maintenance (in lakhs),municipal budget,Public Finance,Smartcities.gov.in data,Jaipur Municipal Corporation,unknown,region,one-time,,2018,open,csv,"CDO- Ajay Kumar, Jaipur Nagar Nigam","JSCL (2019) Ministry of housing and urban affairs,smart city data catalogue, NA",https://smartcities.data.gov.in/catalog/budget-open-spaces-development-jaipur,Go to source URL
121,Financial Health : Jaipur,This catalogue contains the yearly municipal's expenditure and revenue,finance; expenditure; revenue,Public Finance,Smartcities.gov.in data,Jaipur Municipal Corporation,unknown,region,one-time,2015,2018,open,csv,"CDO- Ajay Kumar, Jaipur Nagar Nigam","JSCL (2019) Ministry of housing and urban affairs,smart city data catalogue, NA",https://smartcities.data.gov.in/catalog/financial-health-jaipur,Go to source URL
123,Vat & Gst Collection For Jaipur,This catalog contains the yearly Total VAT/GST collection during the year (in INR Cr),tax; VAT; GST; revenue,Public Finance,Smartcities.gov.in data,Jaipur District,unknown,district,one-time,2014,2018,open,csv,"CDO- Ajay Kumar, Jaipur Nagar Nigam","JSCL (2019) Ministry of housing and urban affairs,smart city data catalogue, NA",https://smartcities.data.gov.in/catalog/vat-gst-collection-jaipur,Go to source URL
120,Water Tax: Jaipur,This catalog contains yearly data of water tax on commercial and residential (2013 to 2018),tax; water tax,Public Finance,Smartcities.gov.in data,Jaipur City,unknown,city,one-time,2013,2018,open,csv,"CDO- Ajay Kumar, Jaipur Nagar Nigam","JSCL (2019) Ministry of housing and urban affairs,smart city data catalogue, NA",https://smartcities.data.gov.in/catalog/water-taxjaipur,Go to source URL
133,Black Spots, Accident prone location names in Jaipur,road accidents,Public Safety & Health,L&T Infra Engineering Transport Study,Jaipur City,unknown,city,one-time,,2018,open,printed map,JDA,"L&T Infra Engineering (2022) Comprehensive Traffic and Transportation Study for Jaipur Region, vol2, Fig 2-32 (pg 2-56, CMP 2018)",Document not yet published,Not currently available
126,Black Spots Of Rajasthan,"This dataset contains the black spots identified by the state in the calender years 2022(2019-2020-2021) in NH and SH in the form of Highway no., location, police station, district, and accident in 3 years",road accidents,Public Safety & Health,,Rajasthan,unknown,state,one-time,2019,2022,open,printed table,"Transport Department, Govt. of Rajasthan","State Road Safety Cell, Department of Transport and Road Safety, Rajasthan, NA",https://roadsafetycell.rkcl.in/pageView/token=UUp2TU8ySXR4SDB0QklrbFN6Q084UT09,Go to source URL
128,Crimes Jaipur,This catalog describes the total number of crimes per year in jaipur city,crime,Public Safety & Health,Smartcities.gov.in data,Jaipur Municipal Corporation,unknown,region,one-time,2014,2018,open,csv,"CDO- Ajay Kumar, Jaipur Nagar Nigam","JSCL (2019) Ministry of housing and urban affairs,smart city data catalogue, NA",https://smartcities.data.gov.in/catalog/crimes-jaipur,Go to source URL
134,Division-Wise Accidents Reports," Accident Report Division wise i.e. East, south, West and North Division",road accidents,Public Safety & Health,L&T Infra Engineering Transport Study,Jaipur City,unknown,city,one-time,,2018,open,chart,JDA,"L&T Infra Engineering (2022) Comprehensive Traffic and Transportation Study for Jaipur Region, vol2, Fig 2-31 (pg 2-55, CMP 2018)",Document not yet published,Not currently available
127,Fatalities By Road Accidents In Jaipur City,This dataset provides the number of deaths caused by road accidents in Jaipur City from the year 2010 to 2017. ,road accidents; faltalities,Public Safety & Health,,Jaipur Municipal Corporation,unknown,region,one-time,2010,2017,open,chart,"Transport Department, Govt. of Rajasthan","Cuts International (n.d.) Jaipur City Mobility Plan, pg. no 8",https://cuts-ccier.org/pdf/jaipur-city-mobility-plan.pdf,Go to source URL
130,Injuries And Fatalities,This catalog contains data of the total number of fatalities and injuries due to traffic accidents yearly data.,road accidents; faltalities,Public Safety & Health,Smartcities.gov.in data,Jaipur Municipal Corporation,unknown,region,one-time,2016,2018,open,csv,"CDO- Ajay Kumar, Jaipur Nagar Nigam","JSCL (2019) Ministry of housing and urban affairs,smart city data catalogue, NA",https://smartcities.data.gov.in/catalog/injuries-and-fatalities,Go to source URL
129,Mortality Rate Jaipur,This catalog contains data of total birth rate and death rate yearly,live events,Public Safety & Health,Smartcities.gov.in data,Jaipur Development Authority (2018),unknown,region,one-time,2013,2018,open,csv,"CDO- Ajay Kumar, Jaipur Nagar Nigam","JSCL (2019) Ministry of housing and urban affairs,smart city data catalogue, NA",https://smartcities.data.gov.in/catalog/mortality-rate-jaipur,Go to source URL
135,On Road Accidents,"this dataset shows the Number of Road Accidents, Persons Killed, Persons Injured and
Severity of Accidents",road accidents,Public Safety & Health,,Jaipur district,unknown,district,one-time,,2018,open,printed table,"Transport Department, Govt. of Rajasthan","Road Accidents in Rajasthan, Transport Department, Government of Rajasthan, Table 1.2, pg-17, row no-16",https://www.tourism.rajasthan.gov.in/content/dam/transport/transport-dept/pdf/roadsafty/Road%20Accidents%20in%20Rajasthan%202018.pdf,Go to source URL
136,On Road Accidents,"this dataset shows the Comparative Analysis of Number of Road Accidents, Persons Killed and
Persons Injured """,road accidents,Public Safety & Health,,Jaipur district,unknown,district,one-time,2017,2018,open,printed table,"Transport Department, Govt. of Rajasthan","Road Accidents in Rajasthan, Transport Department, Government of Rajasthan, Table 1:3, pg-20, row no-16",https://www.tourism.rajasthan.gov.in/content/dam/transport/transport-dept/pdf/roadsafty/Road%20Accidents%20in%20Rajasthan%202018.pdf,Go to source URL
125,On Road Crash Scenario Of Rajasthan,"This dataset contains the summary of road crashes in rajasthan, comparative analysis of road accidents, month wise road accidents,killed and injured, road accident killed and injured according to time,according to road category,percentage share of people killed according to category of road, (summary -2014 to 2023, others -2022 &2023)",road accidents,Public Safety & Health,,Rajasthan,unknown,state,one-time,2014,2023,open,printed table,Rajasthan Knowledge Corporation Limited and State Road Safety Cell,"State Road Safety Cell, Department of Transport and Road Safety, Rajasthan, NA",https://roadsafetycell.rkcl.in/pageView/token=TXFXZzE0R0RxVlppTmlNVi9PSFlOUT09,Go to source URL
131,Security Surveillance,"List of junctions where surveillance cameras are installed
",cameras; monitoring,Public Safety & Health,L&T Infra Engineering Transport Study,,unknown,discrete locations,one-time,,2022,private,,"Traffic Police, Jaipur","L&T Infra Engineering (2022) Comprehensive Traffic and Transportation Study for Jaipur Region, vol2, ANNEXURE - 2-1, pg. 1 of 2-1",Document not yet published,Not currently available
132,Traffic Signals At Junctions,List of junctions where traffic signals have been installed in Jaipur city,traffic signals,Public Safety & Health,L&T Infra Engineering Transport Study,Jaipur City,unknown,city,one-time,,2018,open,printed table,"Traffic Police, Jaipur","L&T Infra Engineering (2022) Comprehensive Traffic and Transportation Study for Jaipur Region, vol2, ANNEXURE-2-1, pg 1 of 2-1",Document not yet published,Not currently available
124,Trauma Centres Of Rajasthan,"This dataset contains the district, trauma centre location, ambulance availability, vehicle no.,and ALS ambulance availability for rajasthan",trauma; road accidents; emergency services,Public Safety & Health,,Rajasthan,unknown,state,one-time,,2023,open,printed table,"State Road Safety Cell, Department of Transport and Road Safety, Rajasthan","State Road Safety Cell, Department of Transport and Road Safety, Rajasthan, NA",https://roadsafetycell.rkcl.in/pageView/token=d3doM0tvbjVvNmVEbkJRM2YycHVUdz09,Go to source URL
164,Availability Of Bus Services In Jaipur Region,The map provides the regional analysis for availability/non-availability of bus services.,public transport; buses,Public Transportation,master plan map,Jaipur Region,unknown,region,one-time,,2001,open,printed map,JDA,"JDA (2011) Master Development Plan 2025, vol1, Map 3-15, pg. 169",https://jda.rajasthan.gov.in/content/dam/raj/udh/development-authority/jda-jaipur/pdf/MDP/Vol1.pdf,Go to source URL
145,Bus Route Map1,This dataset  in Figure 2-25: JCTSL Bus Route Map,public transport; buses,Public Transportation,L&T Infra Engineering Transport Study,Jaipur City,unknown,city,one-time,,2018,private,printed map,JDA,"L&T Infra Engineering (2022) Comprehensive Traffic and Transportation Study for Jaipur Region, vol1, Figure 2-25, pg. 2-43",Document not yet published,Not currently available
144,Bus Route Map2,This dataset in Figure 2-26: JCTSL Bus Route Map,public transport; buses,Public Transportation,L&T Infra Engineering Transport Study,Jaipur City,unknown,city,one-time,,2018,private,printed map,JMC,"L&T Infra Engineering (2022) Comprehensive Traffic and Transportation Study for Jaipur Region, vol1, Figure 2-26, pg. 2-44",Document not yet published,Not currently available
155,Buses Jaipur,This dataset contains the number of buses in Jaipur City,public transport; buses,Public Transportation,Smartcities.gov.in data,,unknown,city,one-time,2015,2017,,,"CDO- Ajay Kumar, Jaipur Nagar Nigam","JSCL (2019) Ministry of housing and urban affairs,smart city data catalogue, NA",https://smartcities.data.gov.in/catalog/buses-jaipur,Go to source URL
141,Details Of Average Ridership (2016-17) On Important Sections Served By Jctsl,Details of Average ridership for important sections in year 2016-17.,public transport; buses; ridership,Public Transportation,L&T Infra Engineering Transport Study,Jaipur City,unknown,city,one-time,,2017,open,printed table,JCTSL,"L&T Infra Engineering (2022) Comprehensive Traffic and Transportation Study for Jaipur Region, vol2, ANNEXURE-2-1, pg 1 of 2-1",Document not yet published,Not currently available
159,Details Of Bus Route Map,Contains simplified Bus route along with railway tracks for 01.05.23,public transport; buses,Public Transportation,,"Jaipur City, specific locations",unknown,city,one-time,,2023,open,printed map,"Transport Department, Govt. of Rajasthan","Jaipur City Transport Services Limited (n.d.), NA",https://transport.rajasthan.gov.in/content/dam/transport/jaipurbus/image/Jaipur%20Bus%20Map%20Final_01.05.23.jpg,Go to source URL
158,Details Of Bus Routes And Frequency,"Contains Bus depot,route, route no., route length, frequency",public transport; buses; level of services,Public Transportation,,"Jaipur City, specific locations",unknown,city,one-time,,2009,open,printed table,Wilbur smith associates,"Wilbur Smith Associates(2010) Traffic and Transportation Study for Detailed Project Report for Proposed Jaipur Metro, ANNEXURE - 2, pg. 113",https://transport.rajasthan.gov.in/content/dam/transport/metro/Project/Traffic%20Study%20by%20Wilbur%20Smith%20Associates-2010/Traffic%20and%20Transportation%20Study%20For%20DPR%20For%20Proposed%20Jaipur%20Metro%20Feb%202010.pdf,Go to source URL
156,Earnings From Bus Trips Jaipur,This dataset contains the earnings from bus trips jaipur,public transport; buses; finance,Public Transportation,Smartcities.gov.in data,,unknown,city,one-time,2015,2017,,,"CDO- Ajay Kumar, Jaipur Nagar Nigam","JSCL (2019) Ministry of housing and urban affairs,smart city data catalogue, NA",https://smartcities.data.gov.in/catalog/earningsfrombustripsjaipur,Go to source URL
151,Existing Bus Circulation To And From Sindhi Camp Terminal,Map showing existing bus routes to and from Sindhi Camp Terminal.,public transport; buses,Public Transportation,L&T Infra Engineering Transport Study,Specific location,unknown,city,one-time,,2022,open,printed map,JDA,"L&T Infra Engineering (2022) Comprehensive Traffic and Transportation Study for Jaipur Region, vol1, Figure 7-21, Pg. 7-25",Document not yet published,Not currently available
165,Existing Bus Terminals In Jaipur City,"Map showing Comparison of Existing and Proposed Terminals 
",public transport; buses; stations,Public Transportation,L&T Infra Engineering Transport Study,Jaipur City,unknown,city,one-time,,2022,private,printed map,JDA,"L&T Infra Engineering (2022) Comprehensive Traffic and Transportation Study for Jaipur Region, vol1, Figure 7-52, Pg. 7-77",Document not yet published,Not currently available
166,Existing Inter-City And Intra-City Depots,"Map showing Existing and proposed Inter-city and Intra-city Depots 
",public transport; buses; depots,Public Transportation,L&T Infra Engineering Transport Study,Jaipur City,unknown,city,one-time,,2022,private,printed map,JDA,"L&T Infra Engineering (2022) Comprehensive Traffic and Transportation Study for Jaipur Region, vol1, Figure 7-54, Pg. 7-79",Document not yet published,Not currently available
152,Existing Jctsl Bus Route Coverage,Map showing Existing and Proposed JCTSL Bus Route Coverage,public transport; buses; level of services,Public Transportation,L&T Infra Engineering Transport Study,Jaipur City,unknown,city,one-time,,2022,open,printed map,JDA,"L&T Infra Engineering (2022) Comprehensive Traffic and Transportation Study for Jaipur Region, vol1, Figure 7-59, Pg. 7-85",Document not yet published,Not currently available
146,Inter City Public Transport,This dataset Figure 2-21 vol1 shows inter-city passenger traffic demand,public transport; buses,Public Transportation,L&T Infra Engineering Transport Study,Jaipur City,unknown,city,one-time,,2018,private,printed map,"RSRTC, JCTSL","L&T Infra Engineering (2022) Comprehensive Traffic and Transportation Study for Jaipur Region, vol1, Figure 2-21, pg. 2-35",Document not yet published,Not currently available
148,Inter City Terminal And Depots,This dataset in Figure 2-23: Map showing various Inter-city (RSRTC) Bus Terminals and Depots,public transport; buses; stations; depots,Public Transportation,L&T Infra Engineering Transport Study,Jaipur City,unknown,city,one-time,,2018,private,printed map,RSRTC,"L&T Infra Engineering (2022) Comprehensive Traffic and Transportation Study for Jaipur Region, vol1, Figure 2-23, pg. 2-39",Document not yet published,Not currently available
