id,title,description,keywords,sector,group,jurisdiction,frequency,granularity_spatial,granularity_temporal,date_earliest,date_latest,access_type,format,provider,reference,url,access_method
202,Digital Payments Jaipur,This catalog provides the Total Collection of municipal Amount collected by ticket sale for Bus and Metro Services,financial services,Services,Smartcities.gov.in data,Jaipur Municipal Corporation,unknown,region,one-time,2017,2018,open,csv,"CDO- Ajay Kumar, Jaipur Nagar Nigam","JSCL (2019) Ministry of housing and urban affairs,smart city data catalogue, NA",https://smartcities.data.gov.in/catalog/digital-payments-jaipur,Go to source URL
199,Education Facilities In Jaipur Region Villages,"This dataset contains the Education Facilities in Jaipur Region Villages based on infrastructure, standard and no. of facilities",education; schools,Services,,Jaipur Region,unknown,region,one-time,,2001,open,printed table,"Directorate of Census Operations, Rajasthan","Master Development Plan 2025 (2011), vol1, Table 3-17, pg.153",https://jda.rajasthan.gov.in/content/dam/raj/udh/development-authority/jda-jaipur/pdf/MDP/Vol1.pdf,Go to source URL
196,"Educational, Recreational And Cultural Facilities, 2009","contains the Name of Town, Number of Educational Facilities(Primary school, Middle school, Secondary school, Senior Secondary school, Arts/ Science/ Commerce colleges (of degree level and above) , Medical colleges,Engineering colleges, Management Institute/ colleges,Polytechnics, Recognised Shorthand, Typewriting and vocational training institutions,Non-formal Education Center (Sarva Shiksha Abhiyan Center), Special School for Disabled, others ), Number of Social, Recreational and Cultural facilities: No. of Orphanage Home, Working women's hostles, No. of Old Age Home, Stadium, Cinema Theatre, Auditorium/ Community halls, Public libraries and Reading rooms",education; cultural facilities; recreation,Services,Census handbook,Jaipur District,unknown,district,one-time,,2009,open,xls/xlsx,"Directorate of Census Operations, Rajasthan","Directorate of Census Operations, Rajasthan (2014) Census of India 2011 - Rajasthan - Series 09 - Part XII B - District Census Handbook, Jaipur, Town Statement-V_0812",https://censusindia.gov.in/nada/index.php/catalog/1069/download/3291/DH_2011_0812-Jaipur.zip,Go to source URL
197,"Industry And Banking, 2009","contains the Name of Town, Names of three most important commodities manufactured, Number of banks (Nationalised Bank,Private Commercial Bank,Co-operative Bank), Number of agricultural credit societies, Number of non-agricultural credit societies",industries; financial services,Services,Census handbook,Jaipur District,unknown,district,one-time,,2009,open,xls/xlsx,"Directorate of Census Operations, Rajasthan","Directorate of Census Operations, Rajasthan (2014) Census of India 2011 - Rajasthan - Series 09 - Part XII B - District Census Handbook, Jaipur, Town Statement-VI_0812",https://censusindia.gov.in/nada/index.php/catalog/1069/download/3291/DH_2011_0812-Jaipur.zip,Go to source URL
195,"Medical Facilities, 2009","contains the Name of Town, No. of Medical facilities (with number of beds in brackets) in Hospitals  (Allopathic & Others), Dispensaries / Health Center, Family Welfare Center, Maternity and Child Welfare Center, Maternity Homes,T.B.Hospital/ Clinic,  Nursing Homes, Veterinary Hospital, Mobile Health Clinic and Others etc., Charitable Hospital/Nursing Home  (Numbers), Medicine Shop (Numbers)",health care,Services,Census handbook,Jaipur District,unknown,district,one-time,,2009,open,xls/xlsx,"Directorate of Census Operations, Rajasthan","Directorate of Census Operations, Rajasthan (2014) Census of India 2011 - Rajasthan - Series 09 - Part XII B - District Census Handbook, Jaipur, Town Statement-IV_0812",https://censusindia.gov.in/nada/index.php/catalog/1069/download/3291/DH_2011_0812-Jaipur.zip,Go to source URL
200,Smart Governance,"This catalog describes the availability of online services for various domains like taxes, challans,fines, service connections, certificates,licenses, tenders, grievance management, tickets & passes, disclosure of documents in yes and no format",governance,Services,Smartcities.gov.in data,Jaipur City,unknown,city,one-time,,2019,open,csv,"CDO- Ajay Kumar, Jaipur Nagar Nigam","JSCL (2019) Ministry of housing and urban affairs,smart city data catalogue, NA",https://smartcities.data.gov.in/catalog/digital-availability-jaipur,Go to source URL
227,Availability Of Footpaths In Walled City,"Map showing Availability of Footpaths in Walled City
",transport; non-motorised; footpath; road transport,Transport Network,L&T Infra Engineering Transport Study,Walled City,unknown,city,one-time,,2022,private,printed map,JDA,"L&T Infra Engineering (2022) Comprehensive Traffic and Transportation Study for Jaipur Region, vol1, Figure 7-38, Pg. 7-54",Document not yet published,Not currently available
225,Availability Of Road Markings In Walled City,Map showing the availability of road markings in the walled city of Jaipur. ,transport; road markings; road transport,Transport Network,L&T Infra Engineering Transport Study,Walled City,unknown,city,one-time,,2022,private,printed map,JDA,"L&T Infra Engineering (2022) Comprehensive Traffic and Transportation Study for Jaipur Region, vol1, Figure 7-8, Pg. 7-12",Document not yet published,Not currently available
226,Availability Of Signage In Walled City,Map showing the availability of Signages in walled city. ,transport; signage; road transport,Transport Network,L&T Infra Engineering Transport Study,Walled City,unknown,city,one-time,,2022,private,printed map,JDA,"L&T Infra Engineering (2022) Comprehensive Traffic and Transportation Study for Jaipur Region, vol1, Figure 7-9, Pg. 7-12",Document not yet published,Not currently available
222,Built Heritage And Cultural Trail,Map highlighting significant heritage sites and cultural landmarks in Jaipur.,cultural trails; road transport,Transport Network,master plan map,Jaipur District,unknown,district,one-time,,2001,open,printed map,JDA,"JDA (2011) Master Development Plan 2025, vol1, Map 2-37, pg. 113",https://jda.rajasthan.gov.in/content/dam/raj/udh/development-authority/jda-jaipur/pdf/MDP/Vol1.pdf,Go to source URL
231,Demarcation Of Traffic Analysis Zones (Taz),"This dataset shows the zone list adopted for travel demand modeling is
as same as the zoning adopted",transport; boundaries,Transport Network,L&T Infra Engineering Transport Study,Jaipur region,unknown,region,one-time,,2022,private,printed map,JDA,"L&T Infra Engineering (2022) Comprehensive Traffic and Transportation Study for Jaipur Region, vol1, Figure 6-4 pg 6-11",Document not yet published,Not currently available
216,District Road Network - Class 2 & Class 3 Town Connectivity,This dataset contains district road network for connectivity of class 2& class 3 towns,road transport,Transport Network,master plan map,Jaipur District,unknown,district,one-time,,2001,open,printed map,JDA,"JDA (2011) Master Development Plan 2025, vol1, Map 2-42, pg.119",https://jda.rajasthan.gov.in/content/dam/raj/udh/development-authority/jda-jaipur/pdf/MDP/Vol1.pdf,Go to source URL
217,District Road Network - Class 3 & Class 4 Town Connectivity,This dataset contains district road network for connectivity of class 3& class 4 towns,road transport,Transport Network,master plan map,Jaipur District,unknown,district,one-time,,2001,open,printed map,JDA,"JDA (2011) Master Development Plan 2025, vol1, Map 2-43, pg. 119",https://jda.rajasthan.gov.in/content/dam/raj/udh/development-authority/jda-jaipur/pdf/MDP/Vol1.pdf,Go to source URL
218,District Road Network - Class 4 & Class 5 Town Connectivity,This dataset contains district road network for connectivity of class 4& class 5 towns,road transport,Transport Network,master plan map,Jaipur District,unknown,district,one-time,,2001,open,printed map,JDA,"JDA (2011) Master Development Plan 2025, vol1, Map 2-44, pg. 120",https://jda.rajasthan.gov.in/content/dam/raj/udh/development-authority/jda-jaipur/pdf/MDP/Vol1.pdf,Go to source URL
219,District Road Network Optimum Connectivity,"The map indicates the optimum connectivity of the district over laying the future towns, growth centres, growth foci, focal villages and service villages. Should be used with Table  2-40 (list of the 57 new towns and their class by 2025)",road transport,Transport Network,master plan map,Jaipur District,unknown,district,one-time,,2001,open,printed map,JDA,"JDA (2011) Master Development Plan 2025, vol1, Map 2-24, pg.88",https://jda.rajasthan.gov.in/content/dam/raj/udh/development-authority/jda-jaipur/pdf/MDP/Vol1.pdf,Go to source URL
215,District Road Network-Class 1 & Class 2 Town Connectivity,This dataset contains district road network for connectivity of class 1& class 2 towns,road transport,Transport Network,master plan map,Jaipur District,unknown,district,one-time,,2001,open,printed map,JDA,"JDA (2011) Master Development Plan 2025, vol1, Map 2-41, pg.118",https://jda.rajasthan.gov.in/content/dam/raj/udh/development-authority/jda-jaipur/pdf/MDP/Vol1.pdf,Go to source URL
230,Encroached Footpaths In Jaipur City,Map showing Encroached Footpaths ,transport; non-motorised; footpath; road transport,Transport Network,L&T Infra Engineering Transport Study,Jaipur City,unknown,city,one-time,,2022,private,printed map,JDA,"L&T Infra Engineering (2022) Comprehensive Traffic and Transportation Study for Jaipur Region, vol1, Figure 7-49, Pg. 7-68",Document not yet published,Not currently available
223,Recreation And Leisure Trail,Map showcasing recreational and leisure areas in Jaipur.,transport; non-motorised; footpath; road transport,Transport Network,master plan map,Jaipur District,unknown,district,one-time,,2001,open,printed map,JDA,"JDA (2011) Master Development Plan 2025, vol1, Map 2-38, pg. 114",https://jda.rajasthan.gov.in/content/dam/raj/udh/development-authority/jda-jaipur/pdf/MDP/Vol1.pdf,Go to source URL
214,Regional Road Network Map,Shows the regional network map,road transport,Transport Network,L&T Infra Engineering Transport Study,Jaipur Region,unknown,region,one-time,,2018,private,printed map,JDA,"L&T Infra Engineering (2022) Comprehensive Traffic and Transportation Study for Jaipur Region, vol1, Figure 2-1, pg. 2-3",Document not yet published,Not currently available
224,Religious And Spiritual Trail,Map detailing religious and spiritual sites in Jaipur.,transport; non-motorised; footpath; road transport,Transport Network,master plan map,Jaipur District,unknown,district,one-time,,2001,open,printed map,JDA,"JDA (2011) Master Development Plan 2025, vol1, Map 2-39, pg. 115",https://jda.rajasthan.gov.in/content/dam/raj/udh/development-authority/jda-jaipur/pdf/MDP/Vol1.pdf,Go to source URL
228,Right Of Way (Row) Widths,"This dataset provides detailed information on the road infrastructure in Jaipur, listing 39 major roads with their respective lengths, right-of-way (ROW), carriage details, and shoulder widths. ",road transport,Transport Network,,Jaipur Region,unknown,region,one-time,,2007,open,printed table,DHV Primary Survey,"JDA (2011) Master Development Plan 2025, vol1, Table 4-21, pg.254",https://jda.rajasthan.gov.in/content/dam/raj/udh/development-authority/jda-jaipur/pdf/MDP/Vol1.pdf,Go to source URL
220,Road Network,This dataset shows Highway Network for JDA Region,road transport,Transport Network,L&T Infra Engineering Transport Study,JDA Boundary,unknown,city,one-time,,2022,private,printed map,JDA,"L&T Infra Engineering (2022) Comprehensive Traffic and Transportation Study for Jaipur Region, vol1, Figure 6-6 pg 6-14",Document not yet published,Not currently available
221,Road Network,This dataset shows the Highway Network for JMC Boundary,road transport,Transport Network,L&T Infra Engineering Transport Study,JMC Boundary,unknown,city,one-time,,2022,private,printed map,JDA,"L&T Infra Engineering (2022) Comprehensive Traffic and Transportation Study for Jaipur Region, vol1, Figure 6-5 pg 6-13",Document not yet published,Not currently available
213,Road Network In Rajasthan (Up To 31.03.2022),"This dataset contains the Road Network in Rajasthan (up to 31.03.2022) with road category, length (km), and percentage  share as the parameters",road transport,Transport Network,,Rajasthan,unknown,state,one-time,,2022,open,printed table,"Public Works Department, Government of Rajasthan","State Road Safety Cell, Department of Transport and Road Safety, Rajasthan, NA",https://roadsafetycell.rkcl.in/pageView/token=Q2twNXhhZk9IaklESkMwMGxoaTgwdz09,Go to source URL
229,Transport Potential In Villages,"This dataset provides transport potential(High, Low, Medium) analysis in Jaipur District. ",transport; settlements,Transport Network,master plan map,Jaipur District,unknown,district,one-time,,2001,open,printed map,JDA,"JDA (2011) Master Development Plan 2025, vol1, Map 2-25, pg. 89",https://jda.rajasthan.gov.in/content/dam/raj/udh/development-authority/jda-jaipur/pdf/MDP/Vol1.pdf,Go to source URL
241,Anpr Camera Locations In Jaipur City,"This catalog contains the Name,ID, device count, address, and Physical Coordinates of the ANPR Camera locations in Jaipur city",cameras; monitoring; ANPR,Transport Network Assets,MoHUA IUDX data,Jaipur Development Authority (2018),unknown,discrete locations,one-time,,,private,json,JDA,"Indian urban data exchange (2023) IUDX, NA",https://catalogue.cos.iudx.org.in/jaipur/dataset/5004baa8-a1ca-45f0-b639-4cef1ec6b089,Go to source URL
242,Environment Sensor Locations In Jaipur City,"This catalog contains the Name, address, and Physical Coordinates of the environment sensor in Jaipur city",sensors; monitoring,Transport Network Assets,MoHUA IUDX data,Jaipur Development Authority (2018),unknown,discrete locations,one-time,,,private,json,JDA,"Indian urban data exchange (2023) IUDX, NA",https://catalogue.cos.iudx.org.in/jaipur/dataset/5004baa8-a1ca-45f0-b639-4cef1ec6b089,Go to source URL
236,Ev Charging Stations,contains a map on EV charging locations,road transport; EV charging,Transport Network Assets,,Rajasthan,unknown,state,one-time,,2024,open,printed map,BEE,"Bureau of Energy Efficiency (2024), NA",https://evyatra.beeindia.gov.in/public-charging-stations/,Go to source URL
238,Level Information From Manhole Sensors In Jaipur City,"This dataset contains the device id, sludge level and observation Date Time of jaipur city",road transport; utilities,Transport Network Assets,MoHUA IUDX data,Jaipur Development Authority (2018),unknown,discrete locations,one-time,,2022,private,json,JDA,"Indian urban data exchange (2023) IUDX, NA",https://catalogue.cos.iudx.org.in/jaipur/dataset/e2e88fc3-95b2-4fcf-91d1-7c81a9a461d6,Go to source URL
239,Manhole Sensor Systems Locations In Jaipur City,"This catalog contains the Name, ID, and Physical Coordinates of the manhole sensor systems in Jaipur City.",road transport; utilities,Transport Network Assets,MoHUA IUDX data,Jaipur Development Authority (2018),unknown,discrete locations,one-time,,,private,json,JDA,"Indian urban data exchange (2023) IUDX, NA",https://catalogue.cos.iudx.org.in/jaipur/dataset/5004baa8-a1ca-45f0-b639-4cef1ec6b089,Go to source URL
234,"Off-Street Parking Accumalation, Supply And Demand Projections","This dataset provides the existing Parking Accumalation, supply and demand projections of the Off-Street Parking spaces of different locations.",road transport; parking,Transport Network Assets,,Jaipur City- specific,unknown,city,one-time,2011,2011,open,printed table,Research Paper,"Management of Parking Spaces in the Walled City of Jaipur , Table 2, Table 5, Fig 3",https://old.ccs.in/internship_papers/2011/245_riddhima_management-of-parking-spaces-in-the-walled-city-of-jaipur_second.pdf,Go to source URL
233,"On-Street Parking Accumalation, Supply And Demand","This dataset provides the existing Parking Accumalation, supply and demand of Parking in the locations, Jauhari Bazaar and the Bapu Bazaar.",road transport; parking,Transport Network Assets,,Jaipur City- specific,unknown,city,one-time,2011,2011,open,printed table,Research Paper,"Management of Parking Spaces in the Walled City of Jaipur , Table 1, Table 4, Fig 1",https://old.ccs.in/internship_papers/2011/245_riddhima_management-of-parking-spaces-in-the-walled-city-of-jaipur_second.pdf,Go to source URL
232,Parking Site Locations In Jaipur City,"This catalog contains the Name, address, and Physical Coordinates of the  parking site locations in Jaipur city.",road transport; parking,Transport Network Assets,MoHUA IUDX data,Jaipur Development Authority (2018),unknown,discrete locations,one-time,,,private,json,JDA,"Indian urban data exchange (2023) IUDX, NA",https://catalogue.cos.iudx.org.in/jaipur/dataset/5004baa8-a1ca-45f0-b639-4cef1ec6b089,Go to source URL
235,Smart Pole Locations In Jaipur City,"This catalog contains the Name, address, and Physical Coordinates of the smart pole location in Jaipur city",road transport; smart poles; utilities,Transport Network Assets,MoHUA IUDX data,Jaipur Development Authority (2018),unknown,discrete locations,one-time,,,private,json,JDA,"Indian urban data exchange (2023) IUDX, NA",https://catalogue.cos.iudx.org.in/jaipur/dataset/5004baa8-a1ca-45f0-b639-4cef1ec6b089,Go to source URL
237,Street Lights Data Jaipur,This catalog contains the ward wise data of total no. of poles of LED Bulbs/NonLED Bulbs and  Number of street lights / poles per km of road,road transport; street lighting; utilities,Transport Network Assets,Smartcities.gov.in data,Jaipur Municipal Corporation,unknown,region,one-time,,2018,open,csv,"CDO- Ajay Kumar, Jaipur Nagar Nigam","JSCL (2019) Ministry of housing and urban affairs,smart city data catalogue, NA",https://smartcities.data.gov.in/catalog/street-lights-data-jaipur,Go to source URL
240,Vcc System Locations In Jaipur City,"This catalog contains the Name, ID,address and Physical Coordinates of the Vehicle Classification Camera(VCC)",road transport; VCC system,Transport Network Assets,MoHUA IUDX data,Jaipur Development Authority (2018),unknown,discrete locations,one-time,,,private,json,JDA,"Indian urban data exchange (2023) IUDX, NA",https://catalogue.cos.iudx.org.in/jaipur/dataset/5004baa8-a1ca-45f0-b639-4cef1ec6b089,Go to source URL
243,Transport Annual Report 2022-23,This dataset contains the annual administrative report for the year (2022-23),transport; road transport,Transport Statistics,,Rajasthan,yearly,state,one-time,2022,2023,open,printed table,"Department of transport and road safety, Rajasthan","Annual administrative report (2022-23), NA",https://transport.rajasthan.gov.in/content/dam/transport/transport-dept/pdf/Statistical-abstract2022-23/prashasnik%20prativedan%202022-23.pdf,Go to source URL
247,Transport Anuual Progress Report,This dataset contains the annual progress report from 2015-16 to 2021-22 in hindi,transport; road transport,Transport Statistics,,Rajasthan,yearly,state,one-time,2015,2022,open,printed table,"Transport Department, Govt. of Rajasthan","Transport Anuual Progress Report, NA",https://transport.rajasthan.gov.in/content/transportportal/en/transport/organisation/AnnualProgressReport.html.html#annualProgressReport,Go to source URL
248,Transport Department Statistical Abstract,This dataset contains the statistical abstract from 2014-2015 to 2019-2020 in English,transport; road transport,Transport Statistics,,Rajasthan,yearly,state,one-time,2014,2020,open,printed table,"Transport Department, Govt. of Rajasthan","STATISTICAL ABSTRACT website, NA",https://transport.rajasthan.gov.in/content/transportportal/en/transport/organisation/statistical-information.html,Go to source URL
246,Transport Dept Yearbook 2018-19,"This dataset contains the general information,routes and highways, permit and licences, revenue collection, vehicle statistics,road accidents, pollution control, enforcement, and miscellaneous data for Rajasthan(2019-20)",transport; road transport,Transport Statistics,,Rajasthan,yearly,state,one-time,2018,2019,open,printed table,"Transport Department, Govt. of Rajasthan","Transport Department, Government of Rajasthan (2018-19) STATISTICAL ABSTRACT, NA",https://transport.rajasthan.gov.in/content/dam/transport/transport-dept/pdf/statistical-abstract2018-19/Trasport%20Department%20Abstract%20Book%2018-19.pdf,Go to source URL
245,Transport Dept Yearbook 2019-20,"This dataset contains the general information,routes and highways, permit and licences, revenue collection, vehicle statistics,road accidents, pollution control, enforcement, and miscellaneous data for Rajasthan(2019-20)",transport; road transport,Transport Statistics,,Rajasthan,yearly,state,one-time,2019,2020,open,printed table,"Transport Department, Govt. of Rajasthan","Transport Department, Government of Rajasthan (2019-20) STATISTICAL YEAR BOOK, NA",https://transport.rajasthan.gov.in/content/dam/transport/transport-dept/pdf/statistical2015-16/Transport%20Dept.%20Statistical%20Year%20Book.pdf,Go to source URL
244,Transport Dept Yearbook 2020-21,"This dataset contains the general information,routes and highways, permit and licences, revenue collection, vehicle statistics,road accidents, pollution control, enforcement, and miscellaneous data for Rajasthan(2020-21)",transport; road transport,Transport Statistics,,Rajasthan,yearly,state,one-time,2020,2021,open,printed table,"Transport Department, Govt. of Rajasthan","Transport Department, Government of Rajasthan (2020-21) STATISTICAL YEAR BOOK, NA",https://transport.rajasthan.gov.in/content/dam/transport/transport-dept/pdf/Statistical%20abstract%202020-21/Transport_Dept_Year_Book.pdf,Go to source URL
269,Average Occupancy,"contains location, direction and average occupancy data",transport; road transport; occupancy,Travel Demand,,"Jaipur City, specific locations",unknown,city,one-time,,2009,open,printed table,Wilbur smith associates,"Traffic Study by Wilbur Smith Associates-2010, ANNEXURE - 2, pg. 125",https://transport.rajasthan.gov.in/content/dam/transport/metro/Project/Traffic%20Study%20by%20Wilbur%20Smith%20Associates-2010/Traffic%20and%20Transportation%20Study%20For%20DPR%20For%20Proposed%20Jaipur%20Metro%20Feb%202010.pdf,Go to source URL
273,Average Trip Length By Various Modes,"contains mode, homebased,non-home based trips, avg. trip length(km)",transport; road transport; travel demand,Travel Demand,,"Jaipur City, specific locations",unknown,city,one-time,,2017,open,printed table,"egis rail,egis india, feedback infra","JMRCL(2018) Comprehensive Mobility Plan - Urban Transport Sector Assessment Report for Jaipur City, Table 0-3 ( Egis survey)",https://transport.rajasthan.gov.in/content/dam/transport/metro/Project/DPR%20Phase%20II/CMP%20Executive%20Summary%20Final.pdf,Go to source URL
250,Classified Traffic Volume Counts,This datasheet shows Location-wise Traffic (PCUs) and Share (%) at Outer Cordon Location,transport; road transport; travel demand,Travel Demand,L&T Infra Engineering Transport Study,Jaipur City,unknown,city,one-time,,2018,private,printed map,JDA,"L&T Infra Engineering (2022) Comprehensive Traffic and Transportation Study for Jaipur Region, vol1, Figure 3-1, p.g 3-6",Document not yet published,Not currently available
267,Journey Purpose At Outer Cordon (%),"contains purpose in % in mode(2 wheeler,car,auto,taxi) for work, business, education, social & recreation, tourism, others",transport; road transport; travel demand,Travel Demand,,"Jaipur City, specific locations",unknown,city,one-time,,2009,open,printed table,Wilbur smith associates,"Wilbur Smith Associates(2010) Traffic and Transportation Study for Detailed Project Report for Proposed Jaipur Metro, ANNEXURE - 2, pg. 124",https://transport.rajasthan.gov.in/content/dam/transport/metro/Project/Traffic%20Study%20by%20Wilbur%20Smith%20Associates-2010/Traffic%20and%20Transportation%20Study%20For%20DPR%20For%20Proposed%20Jaipur%20Metro%20Feb%202010.pdf,Go to source URL
258,Midblock Traffic Movement - 16 Hours & 24 Hours With Midblock Location Map,"This dataset contains the midblock traffic location and traffic movement towards North,south,east,west with the number of vehicles and PCUs",transport; road transport; travel demand,Travel Demand,,"Jaipur City, specific locations",unknown,city,one-time,,2009,open,printed table,Wilbur smith associates,"Wilbur Smith Associates(2010) Traffic and Transportation Study for Detailed Project Report for Proposed Jaipur Metro, Table 2.6, Table 2.7, Figure 2.10",https://transport.rajasthan.gov.in/content/dam/transport/metro/Project/Traffic%20Study%20by%20Wilbur%20Smith%20Associates-2010/Traffic%20and%20Transportation%20Study%20For%20DPR%20For%20Proposed%20Jaipur%20Metro%20Feb%202010.pdf,Go to source URL
274,Modal Share Of Transport,This dataset provides the percentage of people who used different modes of transportation in 2009 and 2018.,transport; road transport; travel demand; mode shares,Travel Demand,,Jaipur City,unknown,city,one-time,2009,2018,open,printed table,JDA,"CMP ppt (n.d), pg. 29",https://cdn.cseindia.org/userfiles/comprehensive_mobility.pdf,Go to source URL
271,Mode Distribution In Jaipur (Including Walk),contains mode distribution with mode and total trips in %,transport; road transport; travel demand; mode shares,Travel Demand,,"Jaipur City, specific locations",unknown,city,one-time,,2017,open,printed table,"egis rail,egis india, feedback infra","JMRCL(2018) Comprehensive Mobility Plan - Urban Transport Sector Assessment Report for Jaipur City, Table 0-1 (Egis survey)",https://transport.rajasthan.gov.in/content/dam/transport/metro/Project/DPR%20Phase%20II/CMP%20Executive%20Summary%20Final.pdf,Go to source URL
